{
  "poll_period": 60,
  "device_name": "RasPiZero_01",
  "mount_path": "/",
  "log_level": "INFO",
  "log_max_bytes": 5242880,
  "log_backup_count": 3,
  "displays": [
    {
      "type": "ssd1306_i2c",
      "enabled": true,
      "show_startup": true,
      "system_screen": true,
      "refresh_period": 5,
      "width": 128,
      "height": 32,
      "address": 60
    },
    {
      "type": "logging",
      "enabled": true,
      "show_startup": false,
      "system_screen": false,
      "refresh_period": 5
    },
    {
      "type": "waveshare_147_st7789",
      "enabled": true,
      "show_startup": false,
      "system_screen": false,
      "refresh_period": 5,
      "spi": {
        "bus": 0,
        "device": 0,
        "mode": 0,
        "max_speed_hz": 40000000
      },
      "pins": {
        "dc": 25,
        "reset": 27,
        "backlight": 18
      }
    }
  ],
  "sensors": [
    {
      "type": "ds18b20",
      "id": "28-0e2461862fc0",
      "path": "/sys/bus/w1/devices/",
      "keys": {
        "temperature": "water_temperature"
      },
      "calibration": {
        "water_temperature": { "offset": 0.0, "slope": 1.0 }
      },
      "ranges": {
        "water_temperature": { "min": 0, "max": 40 }
      },
      "smoothing": {},
      "interval": 5,
      "max_retries": 3,
      "retry_base_delay": 0.5
    },
    {
      "type": "DHT22",
      "id": "gpio17",
      "pin": 17,
      "keys": {
        "temperature": "air_temperature",
        "humidity": "air_humidity"
      },
      "calibration": {
        "air_temperature": { "offset": 0.0, "slope": 1.0 },
        "air_humidity": { "offset": 0.0, "slope": 1.0 }
      },
      "ranges": {
        "air_temperature": { "min": -40, "max": 80 },
        "air_humidity": { "min": 0, "max": 100 }
      },
      "smoothing": {},
      "interval": 15,
      "max_retries": 3,
      "retry_base_delay": 0.5
    },
    {
      "type": "water_level",
      "id": "grove_water_level",
      "bus": 1,
      "low_address": 119,
      "keys": {
        "water_level": "water_level"
      },
      "calibration": {
        "water_level": { "offset": 0.0, "slope": 1.0 }
      },
      "ranges": {
        "water_level": { "min": 0, "max": 100 }
      },
      "smoothing": {},
      "interval": 5,
      "max_retries": 3,
      "retry_base_delay": 0.5
    },
    {
      "type": "water_flow",
      "id": "gpio23",
      "pin": 23,
      "keys": {
        "flow_smoothed": "water_flow",
        "flow_instant": "water_flow_instant"
      },
      "calibration": {
        "water_flow": { "offset": 0.0, "slope": 1.0 },
        "water_flow_instant": { "offset": 0.0, "slope": 1.0 }
      },
      "ranges": {
        "water_flow": { "min": 0, "max": 30 },
        "water_flow_instant": { "min": 0, "max": 30 }
      },
      "smoothing": {},
      "precision": {
        "water_flow": 2,
        "water_flow_instant": 2
      },
      "interval": 5,
      "max_retries": 3,
      "retry_base_delay": 0.5,
      "sample_window": 5,
      "sliding_window_s": 3,
      "glitch_us": 200,
      "calibration_constant": 3.3
    }
  ]
}
